{
  "schemaVersion": "1.0.0",
  "catalogId": "interlockgo-answer-register",
  "lastReviewedDate": "2026-08-27",
  "answers": [
    {
      "id": "IG-BUS-001",
      "category": "business-contact",
      "customerWording": "Which telephone number should I use for shop service?",
      "alternateWording": ["What is the direct shop number?", "Who do I call for a calibration appointment?"],
      "publicAnswer": "Call InterlockGo directly at 970-515-5740 for local appointments and shop service. To text the shop, use the Google Voice text line at 970-239-1354.",
      "internalStaffAnswer": "Use 970-515-5740 as the direct shop call line and 970-239-1354 as the Google Voice text line. Do not describe provider enrollment/tracking numbers as the direct shop line until their routing is confirmed.",
      "sources": [{"title": "InterlockGo contact page", "url": "https://interlockgo.io/contactus/", "authorityLevel": "3-interlockgo-policy", "verifiedOn": "2026-08-27"}],
      "applicability": ["InterlockGo", "all providers", "local shop service"],
      "classification": "public",
      "effectiveDate": "2026-08-27",
      "lastReviewedDate": "2026-08-27",
      "nextReviewDate": "2026-09-26",
      "owner": "Anson Cordeiro",
      "approver": null,
      "approvedOn": null,
      "escalationDestination": "InterlockGo owner",
      "warning": "Confirm the number remains operational before approval.",
      "status": "draft",
      "publicationDestinations": ["website-faq", "staff-assistant", "phone-guide"]
    },
    {
      "id": "IG-BUS-002",
      "category": "business-contact",
      "customerWording": "Which numbers are provider enrollment or support numbers?",
      "alternateWording": ["Why does LifeSafer show a different number?", "Why does Guardian show another Evans phone?"],
      "publicAnswer": "InterlockGo's direct shop line is 970-515-5740. LifeSafer currently displays 970-812-1994 for its Evans listing and Guardian displays 970-368-3466; their exact routing is being verified. LifeSafer provider support is 800-634-3077 and Guardian provider support is 800-499-0994.",
      "internalStaffAnswer": "Treat 970-812-1994 and 970-368-3466 as provider-owned enrollment/tracking lines until the owner confirms routing. Use 800-634-3077 for LifeSafer provider support and 800-499-0994 for Guardian provider support.",
      "sources": [
        {"title": "LifeSafer Evans location", "url": "https://www.lifesafer.com/locations/colorado/evans/1939l/", "authorityLevel": "2-provider", "verifiedOn": "2026-08-27"},
        {"title": "Guardian Evans location", "url": "https://www.guardianinterlock.com/locations/colorado/evans/", "authorityLevel": "2-provider", "verifiedOn": "2026-08-27"}
      ],
      "applicability": ["LifeSafer", "Guardian", "telephone routing"],
      "classification": "public",
      "effectiveDate": "2026-08-27",
      "lastReviewedDate": "2026-08-27",
      "nextReviewDate": "2026-09-26",
      "owner": "Anson Cordeiro",
      "approver": null,
      "approvedOn": null,
      "escalationDestination": "InterlockGo owner and provider account representatives",
      "warning": "Do not promise where the two location-listing numbers route until verified.",
      "status": "draft",
      "publicationDestinations": ["website-faq", "staff-assistant", "phone-guide"]
    },
    {
      "id": "IG-BUS-003",
      "category": "responsibility-routing",
      "customerWording": "When should I contact InterlockGo, the provider, or Colorado DMV?",
      "alternateWording": ["Who owns my next step?", "Do I call the shop or DMV?"],
      "publicAnswer": "Contact InterlockGo for local appointments and shop service; contact LifeSafer or Guardian for provider-account, device-support, or provider-code issues; contact Colorado DMV for license status, eligibility, restriction duration, extensions, and removal authorization. Your current DMV notice controls your case.",
      "internalStaffAnswer": "Route local work to the shop, provider account/device issues to the relevant provider, and every individualized eligibility or licensing decision to DMV. Never infer a customer's status from a general rule.",
      "sources": [
        {"title": "Colorado ignition-interlock rule", "url": "https://dmv.colorado.gov/sites/dmv/files/Hrng%20Rule%2011%20Interlock-Restricted%20Licenses.pdf", "authorityLevel": "1-colorado-dmv", "verifiedOn": "2026-08-27"},
        {"title": "InterlockGo contact page", "url": "https://interlockgo.io/contactus/", "authorityLevel": "3-interlockgo-policy", "verifiedOn": "2026-08-27"}
      ],
      "applicability": ["Colorado", "all providers", "responsibility routing"],
      "classification": "public",
      "effectiveDate": "2026-08-27",
      "lastReviewedDate": "2026-08-27",
      "nextReviewDate": "2026-11-25",
      "owner": "Anson Cordeiro",
      "approver": null,
      "approvedOn": null,
      "escalationDestination": "Colorado DMV or relevant provider",
      "warning": "No personalized legal advice or eligibility promises.",
      "status": "draft",
      "publicationDestinations": ["website-faq", "staff-assistant", "phone-guide"]
    },
    {
      "id": "IG-BUS-004",
      "category": "business-hours",
      "customerWording": "What are InterlockGo's shop hours?",
      "alternateWording": ["Are you open Tuesday?", "Are you open Thursday?"],
      "publicAnswer": "InterlockGo's regular hours are Monday, Wednesday, and Friday 8:00 AM-6:00 PM and Saturday 8:00 AM-2:00 PM. Tuesday, Thursday, and Sunday are closed. A Tuesday or Thursday installation may be available only by advance appointment; call 970-515-5740 or text 970-239-1354 to ask before traveling.",
      "internalStaffAnswer": "The owner confirmed Tuesday and Thursday are closed for regular business. An installation may be scheduled on either day by advance arrangement, but neither day may be represented as a regular open day. LifeSafer and Guardian listings remain inconsistent and need external correction.",
      "sources": [
        {"title": "InterlockGo hours", "url": "https://interlockgo.io/hours/", "authorityLevel": "3-interlockgo-policy", "verifiedOn": "2026-08-27"},
        {"title": "LifeSafer Evans location", "url": "https://www.lifesafer.com/locations/colorado/evans/1939l/", "authorityLevel": "2-provider", "verifiedOn": "2026-08-27"},
        {"title": "Guardian Evans location", "url": "https://www.guardianinterlock.com/locations/colorado/evans/", "authorityLevel": "2-provider", "verifiedOn": "2026-08-27"}
      ],
      "applicability": ["InterlockGo", "shop hours"],
      "classification": "public",
      "effectiveDate": "2026-08-27",
      "lastReviewedDate": "2026-08-27",
      "nextReviewDate": "2026-09-26",
      "owner": "Anson Cordeiro",
      "approver": null,
      "approvedOn": null,
      "escalationDestination": "InterlockGo owner",
      "warning": "Tuesday and Thursday installation availability is appointment-specific, not a regular opening or guarantee.",
      "status": "draft",
      "publicationDestinations": ["website-faq", "structured-data", "llms-txt", "staff-assistant"]
    },
    {
      "id": "IG-BUS-005",
      "category": "business-location",
      "customerWording": "Where is InterlockGo?",
      "alternateWording": ["Where is the Evans shop?", "Which entrance should I use?"],
      "publicAnswer": "InterlockGo is at 3610 35th Avenue, Unit 7, Evans, Colorado 80620. Drive to the rear of the building for the garage entrance.",
      "internalStaffAnswer": "The address matches InterlockGo, LifeSafer, Guardian, and BBB listings. Confirm any temporary access or parking change before publishing an exception.",
      "sources": [{"title": "InterlockGo contact page", "url": "https://interlockgo.io/contactus/", "authorityLevel": "3-interlockgo-policy", "verifiedOn": "2026-08-27"}],
      "applicability": ["InterlockGo", "Evans location"],
      "classification": "public",
      "effectiveDate": "2026-08-27",
      "lastReviewedDate": "2026-08-27",
      "nextReviewDate": "2027-02-23",
      "owner": "Anson Cordeiro",
      "approver": null,
      "approvedOn": null,
      "escalationDestination": "InterlockGo owner",
      "warning": "None.",
      "status": "draft",
      "publicationDestinations": ["website-faq", "structured-data", "llms-txt", "staff-assistant"]
    },
    {
      "id": "IG-BUS-006",
      "category": "supported-providers",
      "customerWording": "Which providers does InterlockGo support?",
      "alternateWording": ["Do you install LifeSafer?", "Do you service Guardian?"],
      "publicAnswer": "InterlockGo is an authorized service location for LifeSafer and Guardian ignition-interlock devices.",
      "internalStaffAnswer": "Provider location pages corroborate the owned-site claim. Device model and vehicle compatibility still require provider-specific confirmation.",
      "sources": [
        {"title": "LifeSafer Evans location", "url": "https://www.lifesafer.com/locations/colorado/evans/1939l/", "authorityLevel": "2-provider", "verifiedOn": "2026-08-27"},
        {"title": "Guardian Evans location", "url": "https://www.guardianinterlock.com/locations/colorado/evans/", "authorityLevel": "2-provider", "verifiedOn": "2026-08-27"}
      ],
      "applicability": ["LifeSafer", "Guardian", "InterlockGo"],
      "classification": "public",
      "effectiveDate": "2026-08-27",
      "lastReviewedDate": "2026-08-27",
      "nextReviewDate": "2027-02-23",
      "owner": "Anson Cordeiro",
      "approver": null,
      "approvedOn": null,
      "escalationDestination": "Relevant provider account representative",
      "warning": "Do not promise a specific device model without compatibility confirmation.",
      "status": "draft",
      "publicationDestinations": ["website-faq", "staff-assistant", "llms-txt"]
    },
    {
      "id": "IG-BUS-007",
      "category": "appointments",
      "customerWording": "How quickly can I get an appointment?",